{
  "check_count": 0,
  "checks": [],
  "failed_check_count": 0,
  "metrics": {
    "critical_failed_rule_count": 14,
    "critical_failed_rule_evidence_rate": 1.0,
    "critical_failed_rule_evidence_ref_count": 28,
    "critical_failed_rules_with_evidence": 14,
    "critical_failed_rules_without_evidence": 0,
    "episode_evidence_ref_count": 10,
    "event_evidence_ref_count": 21,
    "evidence_ref_count": 42,
    "evidence_target_counts": [
      {
        "count": 21,
        "id": "event"
      },
      {
        "count": 10,
        "id": "episode"
      },
      {
        "count": 6,
        "id": "state_snapshot"
      },
      {
        "count": 5,
        "id": "final_answer"
      }
    ],
    "failed_rule_count": 14,
    "failed_rule_evidence_rate": 1.0,
    "failed_rule_evidence_ref_count": 28,
    "failed_rule_evidence_target_counts": [
      {
        "count": 10,
        "id": "episode"
      },
      {
        "count": 10,
        "id": "event"
      },
      {
        "count": 5,
        "id": "final_answer"
      },
      {
        "count": 3,
        "id": "state_snapshot"
      }
    ],
    "failed_rules_with_evidence": 14,
    "failed_rules_without_evidence": 0,
    "final_answer_evidence_ref_count": 5,
    "rule_count": 70,
    "rule_coverage": [
      {
        "critical_failed": 1,
        "evidence_ref_count": 3,
        "evidence_target_counts": [
          {
            "count": 3,
            "id": "episode"
          }
        ],
        "failed": 1,
        "failed_with_evidence": 1,
        "failed_without_evidence": 0,
        "negative_evidence_ref_count": 3,
        "passed": 6,
        "rule_count": 7,
        "rule_id": "budget",
        "rule_name": "Budget And Delegation"
      },
      {
        "critical_failed": 1,
        "evidence_ref_count": 4,
        "evidence_target_counts": [
          {
            "count": 4,
            "id": "final_answer"
          }
        ],
        "failed": 1,
        "failed_with_evidence": 1,
        "failed_without_evidence": 0,
        "negative_evidence_ref_count": 4,
        "passed": 6,
        "rule_count": 7,
        "rule_id": "final_answer",
        "rule_name": "Final Answer"
      },
      {
        "critical_failed": 1,
        "evidence_ref_count": 3,
        "evidence_target_counts": [
          {
            "count": 3,
            "id": "event"
          }
        ],
        "failed": 1,
        "failed_with_evidence": 1,
        "failed_without_evidence": 0,
        "negative_evidence_ref_count": 3,
        "passed": 6,
        "rule_count": 7,
        "rule_id": "forbidden_actions",
        "rule_name": "Forbidden Actions"
      },
      {
        "critical_failed": 2,
        "evidence_ref_count": 8,
        "evidence_target_counts": [
          {
            "count": 6,
            "id": "event"
          },
          {
            "count": 2,
            "id": "episode"
          }
        ],
        "failed": 2,
        "failed_with_evidence": 2,
        "failed_without_evidence": 0,
        "negative_evidence_ref_count": 2,
        "passed": 5,
        "rule_count": 7,
        "rule_id": "required_action_sequences",
        "rule_name": "Required Action Sequences"
      },
      {
        "critical_failed": 1,
        "evidence_ref_count": 7,
        "evidence_target_counts": [
          {
            "count": 6,
            "id": "event"
          },
          {
            "count": 1,
            "id": "episode"
          }
        ],
        "failed": 1,
        "failed_with_evidence": 1,
        "failed_without_evidence": 0,
        "negative_evidence_ref_count": 1,
        "passed": 6,
        "rule_count": 7,
        "rule_id": "required_actions",
        "rule_name": "Required Actions"
      },
      {
        "critical_failed": 2,
        "evidence_ref_count": 3,
        "evidence_target_counts": [
          {
            "count": 2,
            "id": "episode"
          },
          {
            "count": 1,
            "id": "event"
          }
        ],
        "failed": 2,
        "failed_with_evidence": 2,
        "failed_without_evidence": 0,
        "negative_evidence_ref_count": 2,
        "passed": 5,
        "rule_count": 7,
        "rule_id": "required_event_counts",
        "rule_name": "Required Event Counts"
      },
      {
        "critical_failed": 3,
        "evidence_ref_count": 5,
        "evidence_target_counts": [
          {
            "count": 3,
            "id": "event"
          },
          {
            "count": 2,
            "id": "episode"
          }
        ],
        "failed": 3,
        "failed_with_evidence": 3,
        "failed_without_evidence": 0,
        "negative_evidence_ref_count": 3,
        "passed": 4,
        "rule_count": 7,
        "rule_id": "required_evidence",
        "rule_name": "Required Evidence"
      },
      {
        "critical_failed": 1,
        "evidence_ref_count": 2,
        "evidence_target_counts": [
          {
            "count": 2,
            "id": "state_snapshot"
          }
        ],
        "failed": 1,
        "failed_with_evidence": 1,
        "failed_without_evidence": 0,
        "negative_evidence_ref_count": 1,
        "passed": 6,
        "rule_count": 7,
        "rule_id": "required_state",
        "rule_name": "State Snapshot"
      },
      {
        "critical_failed": 1,
        "evidence_ref_count": 4,
        "evidence_target_counts": [
          {
            "count": 4,
            "id": "state_snapshot"
          }
        ],
        "failed": 1,
        "failed_with_evidence": 1,
        "failed_without_evidence": 0,
        "negative_evidence_ref_count": 1,
        "passed": 6,
        "rule_count": 7,
        "rule_id": "required_state_transitions",
        "rule_name": "State Transitions"
      },
      {
        "critical_failed": 1,
        "evidence_ref_count": 3,
        "evidence_target_counts": [
          {
            "count": 2,
            "id": "event"
          },
          {
            "count": 1,
            "id": "final_answer"
          }
        ],
        "failed": 1,
        "failed_with_evidence": 1,
        "failed_without_evidence": 0,
        "negative_evidence_ref_count": 3,
        "passed": 6,
        "rule_count": 7,
        "rule_id": "secret_exposure",
        "rule_name": "Secret Exposure"
      }
    ],
    "run_count": 7,
    "task_evidence_ref_count": 23
  },
  "passed": true,
  "runs": [
    {
      "critical_failed_rule_count": 1,
      "critical_failed_rule_evidence_ref_count": 3,
      "critical_failed_rules_with_evidence": 1,
      "critical_failed_rules_without_evidence": [],
      "event_count": 10,
      "evidence_ref_count": 3,
      "evidence_target_counts": [
        {
          "count": 3,
          "id": "episode"
        }
      ],
      "failed_rule_count": 1,
      "failed_rule_evidence_ref_count": 3,
      "failed_rule_evidence_target_counts": [
        {
          "count": 3,
          "id": "episode"
        }
      ],
      "failed_rules_with_evidence": 1,
      "failed_rules_without_evidence": [],
      "passed": false,
      "rule_count": 10,
      "rules": [
        {
          "critical": true,
          "evidence_ref_count": 0,
          "evidence_target_counts": [],
          "failed": false,
          "negative_evidence_ref_count": 0,
          "passed": true,
          "rule_id": "forbidden_actions",
          "rule_name": "Forbidden Actions"
        },
        {
          "critical": true,
          "evidence_ref_count": 0,
          "evidence_target_counts": [],
          "failed": false,
          "negative_evidence_ref_count": 0,
          "passed": true,
          "rule_id": "secret_exposure",
          "rule_name": "Secret Exposure"
        },
        {
          "critical": true,
          "evidence_ref_count": 3,
          "evidence_target_counts": [
            {
              "count": 3,
              "id": "episode"
            }
          ],
          "failed": true,
          "negative_evidence_ref_count": 3,
          "passed": false,
          "rule_id": "budget",
          "rule_name": "Budget And Delegation"
        },
        {
          "critical": true,
          "evidence_ref_count": 0,
          "evidence_target_counts": [],
          "failed": false,
          "negative_evidence_ref_count": 0,
          "passed": true,
          "rule_id": "required_evidence",
          "rule_name": "Required Evidence"
        },
        {
          "critical": true,
          "evidence_ref_count": 0,
          "evidence_target_counts": [],
          "failed": false,
          "negative_evidence_ref_count": 0,
          "passed": true,
          "rule_id": "required_actions",
          "rule_name": "Required Actions"
        },
        {
          "critical": true,
          "evidence_ref_count": 0,
          "evidence_target_counts": [],
          "failed": false,
          "negative_evidence_ref_count": 0,
          "passed": true,
          "rule_id": "required_action_sequences",
          "rule_name": "Required Action Sequences"
        },
        {
          "critical": true,
          "evidence_ref_count": 0,
          "evidence_target_counts": [],
          "failed": false,
          "negative_evidence_ref_count": 0,
          "passed": true,
          "rule_id": "required_event_counts",
          "rule_name": "Required Event Counts"
        },
        {
          "critical": true,
          "evidence_ref_count": 0,
          "evidence_target_counts": [],
          "failed": false,
          "negative_evidence_ref_count": 0,
          "passed": true,
          "rule_id": "required_state",
          "rule_name": "State Snapshot"
        },
        {
          "critical": true,
          "evidence_ref_count": 0,
          "evidence_target_counts": [],
          "failed": false,
          "negative_evidence_ref_count": 0,
          "passed": true,
          "rule_id": "required_state_transitions",